id;name;address;description;version;created_by;created_date;last_modified_by;last_modified_date;deleted_by;deleted_date
6a789711-4be0-df69-8d0d-a3c77ba7bc87;Haulmont (Воронеж);Россия, г. Воронеж, ул. Комиссаржевской, д. 10;БЦ "Премьер", офис 12-05;1;admin;2022-07-10 23:15:04.833;;2022-07-10 23:15:04.833;;
780f38f6-4d1a-0c91-e8e0-0305cfb248c3;Haulmont (Самара, головной офис);Россия, г. Самара, ул. Гастелло, д. 43a;;1;admin;2022-07-10 23:16:10.101;;2022-07-10 23:16:10.101;;
bde06d2d-d28a-d83c-7c0d-6e8917970576;Haulmont (Самара ТЕЗИС);Россия, г. Самара, ул. Советской Армии, д. 151;;1;admin;2022-07-10 23:16:43.015;;2022-07-10 23:16:43.015;;
ad5dca9a-3196-32f7-56b7-e57299fe1875;Haulmont (Тольятти);Россия, г. Тольятти, ул. 40 лет Победы, д. 41;;1;admin;2022-07-10 23:17:12.16;;2022-07-10 23:17:12.16;;
aa76345b-4c08-ec79-ee03-7b2857d5661b;Haulmont (Саратов);Россия, г. Саратов, ул. Рабочая, д. 145а, оф.301;;1;admin;2022-07-10 23:17:31.784;;2022-07-10 23:17:31.784;;
